{
  "$schema": "https://json-schema.org/draft/2020-12/schema",
  "$id": "https://github.com/snicolello/project_recovery/manifest/schema.json",
  "title": "Project Recovery manifest",
  "description": "Declares a vault's project roots, the baseline note and labelled lines that answer each recovery field, the decision sources, and the authority policy. Version 0.1 (releases R1 and R2). recipe.validate_manifest and authority.validate_policy enforce the required keys and the constraints marked below.",
  "type": "object",
  "required": ["manifest_version", "name", "vault", "index", "budget", "authority_policy", "projects"],
  "properties": {
    "manifest_version": {"const": "0.1"},
    "name": {"type": "string", "pattern": "^[a-z0-9-]+$", "description": "Names the derived index directory under .qmd/."},
    "description": {"type": "string"},
    "vault": {
      "type": "object",
      "required": ["root"],
      "properties": {
        "root": {"type": "string", "description": "Vault root, relative to the manifest file. Source locators in receipts are relative to this root. Overridable with --vault-root."}
      }
    },
    "index": {
      "type": "object",
      "required": ["engine", "version", "search"],
      "properties": {
        "engine": {"const": "qmd"},
        "version": {"const": "2.8.3"},
        "search": {
          "type": "object",
          "required": ["type", "rerank"],
          "properties": {
            "type": {"const": "lex", "description": "R1 is lexical only."},
            "rerank": {"const": false},
            "limit": {"type": "integer", "minimum": 1, "maximum": 50, "default": 10}
          }
        },
        "embeddings": {"const": false}
      }
    },
    "budget": {
      "type": "object",
      "required": ["max_tokens"],
      "properties": {
        "max_tokens": {"type": "integer", "minimum": 1, "default": 4000},
        "tokenizer": {"const": "approx-utf8-bytes-div-3"}
      }
    },
    "authority_policy": {
      "type": "object",
      "description": "R2 (owner ruling B). Which GitHub acceptance records can turn a local decision claim into an accepted decision, and how they are read.",
      "required": ["local_claims", "verifier", "acceptance_records", "repositories", "reference"],
      "properties": {
        "local_claims": {"const": "decision_candidates", "description": "A note whose frontmatter status is accepted, or a baseline 'Accepted decision:' line, is a decision candidate, never an accepted decision by itself."},
        "verifier": {
          "type": "object",
          "required": ["transport", "serial"],
          "properties": {
            "transport": {"enum": ["offline", "snapshot", "gh"], "description": "Default transport; recover.py --verifier overrides it. offline reads nothing (every referenced record is unverified); snapshot reads fixed REST response files; gh runs read-only gh api GET requests."},
            "serial": {"const": true, "description": "Requests run one at a time; a concurrent request is refused."},
            "snapshot_dir": {"type": "string", "description": "Snapshot root relative to this file, laid out as <host>/<api_path>.json."}
          }
        },
        "acceptance_records": {
          "type": "array",
          "description": "Record kinds that count as acceptance.",
          "items": {
            "type": "object",
            "required": ["kind"],
            "properties": {
              "kind": {"enum": ["pull_merge", "pull_review", "issue_comment"]},
              "rule": {"type": "string"},
              "body_marker": {"type": "string", "description": "issue_comment only: text the comment body must contain."}
            }
          }
        },
        "repositories": {
          "type": "array",
          "description": "Allowlisted repositories. A record counts only for the projects listed and only when made by an approver.",
          "items": {
            "type": "object",
            "required": ["host", "repo", "projects", "approvers"],
            "properties": {
              "host": {"type": "string"},
              "repo": {"type": "string", "pattern": "^[^/]+/[^/]+$"},
              "projects": {"type": "array", "items": {"type": "string"}},
              "approvers": {"type": "array", "minItems": 1, "items": {"type": "string"}}
            }
          }
        },
        "reference": {
          "type": "object",
          "description": "How a decision note names its one acceptance record: a frontmatter key, else the first body line starting with a label. The line is cited with a receipt.",
          "properties": {
            "frontmatter_key": {"type": "string"},
            "body_labels": {"type": "array", "items": {"type": "string"}}
          }
        },
        "binding": {
          "type": "object",
          "description": "Binds a record to the citing note. A pull merge or review promotes only when the note declares this frontmatter key and the record's subject revision (pull request head or reviewed commit) equals it. An issue comment must contain body_marker followed by the note's permalink or title. A record cited by more than one note in the project binds none of them.",
          "properties": {
            "frontmatter_key": {"type": "string"},
            "record_field": {"const": "subject_revision"}
          }
        },
        "note": {"type": "string"}
      }
    },
    "projects": {
      "type": "object",
      "minProperties": 1,
      "additionalProperties": {
        "type": "object",
        "required": ["collection", "root", "baseline_note", "fields", "decision_statuses", "authority"],
        "properties": {
          "collection": {"type": "string", "description": "QMD collection name; every query is scoped to it."},
          "root": {"type": "string", "description": "Project directory relative to the vault root (allowlisted source root)."},
          "baseline_note": {"type": "string", "description": "Note, relative to the project root, that states the recovery fields."},
          "fields": {
            "type": "object",
            "required": ["objective", "current_state", "blockers", "next_action", "accepted_decisions"],
            "additionalProperties": {"type": "array", "items": {"type": "string"}, "description": "Line prefixes in the baseline note that answer this field. Each matching line is cited verbatim."}
          },
          "decision_statuses": {"type": "array", "items": {"type": "string"}, "description": "Frontmatter status values that mark a note as a decision source. 'accepted' makes a decision candidate (accepted_decisions only after verification); others go to other_decisions."},
          "authority": {
            "type": "object",
            "properties": {
              "record": {"type": "string", "description": "Governing record, relative to the project root."},
              "record_key": {"type": "string", "default": "status"},
              "approver_labels": {"type": "array", "items": {"type": "string"}},
              "approvals": {
                "type": "array",
                "items": {
                  "type": "object",
                  "required": ["name", "note", "label"],
                  "properties": {
                    "name": {"type": "string"},
                    "note": {"type": "string"},
                    "label": {"type": "string", "description": "A line whose value starts with UNKNOWN yields unknown, with the line cited as evidence."}
                  }
                }
              }
            }
          }
        }
      }
    }
  }
}
